{
  "allocation": {
    "added": [],
    "changed": [
      "btns.btn3"
    ],
    "removed": []
  },
  "components_only_in_a": [],
  "components_only_in_b": [],
  "incumbents": "watchy_v1_draft",
  "minimal_disturbance_violations": [],
  "stamp_a": {
    "locks": {
      "external-interface": 0,
      "firmware-facing": 0
    },
    "series": "A"
  },
  "stamp_b": {
    "locks": {
      "external-interface": 0,
      "firmware-facing": 0
    },
    "series": "A"
  },
  "terminals": [
    {
      "a": null,
      "b": "btns.btn3.0.io",
      "refdes": "U4",
      "terminal": "42"
    },
    {
      "a": "btns.btn3.0.io",
      "b": null,
      "refdes": "U4",
      "terminal": "5"
    }
  ]
}
